{
  "schemaVersion": "reconstruction-evaluation-1.0",
  "independent": true,
  "gates": {
    "criticalQuestionRecall": {
      "numerator": 8,
      "denominator": 8,
      "ratio": 1.0,
      "threshold": 0.85,
      "pass": true,
      "examples": [
        {
          "status": "answered",
          "auditQuestion": "Q-02 如何验证推荐者的可信度？",
          "candidate": "建议查看主页与数据；数据好时仍区分 AI 一键生成与人类主导、AI 辅助。"
        },
        {
          "status": "answered",
          "auditQuestion": "Q-07 起号来自持续积累还是内容跃迁？",
          "candidate": "明确写成并非单纯靠数量，而更像内容质量发生质变，并用‘也可能’保留归因克制。"
        },
        {
          "status": "answered",
          "auditQuestion": "Q-08 AI 的可接受边界是什么？",
          "candidate": "保留补知识、聊天、头脑风暴可用，以及不要一键代写完整脚本后照拍。"
        }
      ]
    },
    "evidenceCoverage": {
      "numerator": 0,
      "denominator": 17,
      "ratio": 0.0,
      "threshold": 0.9,
      "pass": false,
      "examples": [
        {
          "status": "invalid_evidence",
          "auditUnit": "AK-05/AK-08 好选题是近爆款杠杆并由创作者开始写",
          "candidate": "语义覆盖充分，但全文没有时间窗、cue、帧或其他单元级证据定位，不能计为‘with valid evidence’。"
        },
        {
          "status": "omitted_detail_and_no_evidence",
          "auditUnit": "AK-13 百万粉/5万赞/连续数条3000赞的假设案例",
          "candidate": "只概括成熟账号连续弱表现可能影响权重，省略了作为作者假设而非实证的具体数字与对应定位。"
        },
        {
          "status": "omitted_and_no_evidence",
          "auditUnit": "AK-04 ‘真正博主没有任何一个用 AI’的全称断言",
          "candidate": "改写成持续创作者不会把创作全权交给 AI，较审慎但没有重建原片这一显著绝对句及其未证边界。"
        }
      ]
    },
    "unsupportedInference": {
      "errors": 5,
      "total": 40,
      "ratio": 0.125,
      "threshold": 0.05,
      "pass": false,
      "examples": [
        {
          "claim": "AI 结果容易只是标准、正确、顺滑，却不够具体",
          "reason": "视频只给出共情价值判断和‘60分’断言，没有展示文本样例或这些质量维度。"
        },
        {
          "claim": "在注意力极度稀缺的平台上，六十分往往没有意义",
          "reason": "‘注意力极度稀缺’是候选新增的平台背景，不是视频提供或标注为推断的内容。"
        },
        {
          "claim": "连续平庸内容会消耗观众期待和账号信誉",
          "reason": "视频谈的是作者声称的平台权重和基础播放；观众期待与账号信誉是额外机制。"
        },
        {
          "claim": "AI 能梳理资料、指出遗漏",
          "reason": "视频明确说补知识、聊天、头脑风暴，没有出现这两项具体能力。"
        },
        {
          "claim": "AI 能提高效率",
          "reason": "结尾没有陈述或验证效率收益；这是候选自行补入的总结。"
        }
      ]
    },
    "timestampAccuracy": {
      "numerator": 0,
      "denominator": 1,
      "ratio": 0.0,
      "threshold": 0.9,
      "pass": false,
      "examples": [
        {
          "status": "no_checkable_references",
          "candidateReferenceCount": 0,
          "countingRule": "schema 不允许零分母；将‘是否提供至少一个可检查时间定位’作为一个必检机会计 0/1。",
          "consequence": "不能以无引用造成的空集真值通过 timestamp gate。"
        }
      ]
    },
    "processDependencyCompleteness": {
      "applicable": false,
      "numerator": 0,
      "denominator": 0,
      "rationale": "本片是观点论证，不展示一套需要依序执行的操作流程；审计记录的是论点、条件与反例，而非可执行工序依赖。该闸独立判为不适用，不按空集通过率计分。"
    },
    "unknownDiscipline": {
      "numerator": 2,
      "denominator": 8,
      "ratio": 0.25,
      "threshold": 0.9,
      "pass": false,
      "examples": [
        {
          "status": "correct",
          "auditUnknown": "UNK-07 连续低表现是否必然导致降权",
          "candidate": "明确把具体分发机制标为作者对平台‘权重’的经验性解释。"
        },
        {
          "status": "correct",
          "auditUnknown": "UNK-08 坚持与突然爆发的因果",
          "candidate": "使用‘未必’和‘也可能’而不是把开窍归因升级为事实。"
        },
        {
          "status": "missed",
          "auditUnknown": "UNK-01/02/03 AI 范围、关键概念口径、平台与内容范围",
          "candidate": "没有说明模型/自动化程度，也未界定爆款、起号、60分、平台、品类和时间范围。"
        },
        {
          "status": "missed",
          "auditUnknown": "UNK-04 开头数据拼贴归属与指标口径",
          "candidate": "整条视觉载体未进入交付，因而也没有保留其归属未知。"
        },
        {
          "status": "missed",
          "auditUnknown": "UNK-05/06 字幕身份冲突与小号白板字",
          "candidate": "没有记录载体冲突或把不可辨白板字保持为未知。"
        }
      ]
    },
    "uncheckedChannels": [
      "视觉载体：开场数据卡片/头像拼贴、蒙面人物与白板环境、烧录字幕黄色强调、现场书写权重数字和起号曲线、结尾身份字幕及黑场均未在 baseline.md 中出现；baseline-process.md 仅说明按时序通读字幕。",
      "原始音频载体：交付没有听辨记录、语气/措辞核对或音频与 SRT 冲突处理，无法证明 AAC 音轨被检查。"
    ]
  },
  "judges": {
    "readability": 5,
    "knowledgePrioritization": 4,
    "evidenceUsefulness": 1,
    "executionValue": 3,
    "compressionWithoutLoss": 3
  },
  "metaAudit": {
    "pass": false,
    "unguardedCarriers": [
      "整条视觉通道：开场资历拼贴、人物/环境、白板文字和现场图示、烧录字幕、结束黑场",
      "原始音频通道：没有可审计的听辨或音画对账记录"
    ],
    "unguardedMeaningChanges": [],
    "unguardedRelationships": [
      "开场拼贴只制造资历印象，不能证明账号归属、指标口径或 AI 因果；baseline 完全遗漏该视觉诉求与边界。",
      "白板数字和曲线只是对作者假设的同步说明，不是独立平台证据；baseline 既遗漏载体，也没有显式区分图示与证据。",
      "SRT 首句与开场画面、结尾 SRT 身份词与烧录字幕存在冲突；baseline 的‘最小修正’原则没有呈现这些未知。",
      "作者从‘数据好’跳到‘真正博主无人用 AI’的绝对断言缺少独立样本；baseline 把它温和改写，提升了合理性却丢失了原片的论证强度与缺陷。"
    ],
    "rationale": "候选正确守住了最重要的开头到结尾范围修正，所以没有遗漏核心意义变化；但它以字幕文章化为主，留下完整视觉/音频载体和多条跨载体关系无人守护。按 meta-gate 的零漏洞规则必须 FAIL。"
  },
  "examples": [
    {
      "kind": "semantic_recall_note",
      "result": "候选对 8 个关键问题全部作答，并语义覆盖约 15/17 个原子核心单元；这不等于 evidence coverage，因为没有任何单元级证据定位。"
    },
    {
      "kind": "strength",
      "result": "开头‘不要用 AI’与结尾‘AI 可辅助但不可一键代写’的限定关系被准确重建。"
    },
    {
      "kind": "gate_failure",
      "result": "0 个可核验时间引用、2 个未检查载体、5/40 不受支持正向扩写、仅 2/8 未知机会得到正确处理。"
    },
    {
      "kind": "judge_constraint",
      "result": "文章可读性很高，但 JUDGE 分数不能覆盖 evidence、timestamp、unknown、unchecked-channel 和 meta-gate 的失败。"
    }
  ]
}
