{
  "schemaVersion": "reconstruction-evaluation-1.0",
  "independent": true,
  "gates": {
    "criticalQuestionRecall": {
      "numerator": 16,
      "denominator": 16,
      "examples": [
        {
          "status": "covered",
          "auditIds": ["Q01", "Q02", "Q03", "Q04"],
          "candidate": ["KU-01", "KU-02B", "KU-03", "KU-04", "KU-05B", "KU-19"],
          "note": "成绩快照与时间过程被分离，第一期角色、书名/来源边界及作者旧框架混入均有回答。"
        },
        {
          "status": "covered",
          "auditIds": ["Q05", "Q06", "Q07", "Q08", "Q09", "Q10"],
          "candidate": ["KU-06", "KU-07", "KU-07C", "KU-08", "KU-09", "KU-10", "KU-11"],
          "note": "三类需求映射、三感六度未知、平台论证、搜索/闲逛、真实性边界、广告品类与五步法均被恢复。"
        },
        {
          "status": "covered",
          "auditIds": ["Q11", "Q12", "Q13", "Q14", "Q15", "Q16"],
          "candidate": ["KU-12", "KU-13", "KU-14", "KU-15", "KU-16", "KU-17", "KU-18", "KU-19"],
          "note": "依赖顺序、视听互补、评论/数据反馈及效果未证明均被回答或正确保留为未知。"
        }
      ]
    },
    "evidenceCoverage": {
      "numerator": 21,
      "denominator": 22,
      "examples": [
        {
          "status": "covered",
          "auditIds": ["K01", "K02", "K03", "K04", "K05", "K06", "K07", "K08", "K09", "K10", "K11"],
          "note": "开场、来源、第一/第二部分的核心单元均有可解析 cue、targeted frame 或 OCR 证据。"
        },
        {
          "status": "partial",
          "auditId": "K12",
          "candidate": "KU-10",
          "note": "广告类别清单被恢复，但 reconstruction.json 没有像独立审计那样明确保存‘第三部分被说成商业合作案例、却未展示实际案例’这一完整边界；article.md 只部分补足段落角色。"
        },
        {
          "status": "covered",
          "auditIds": ["K13", "K14", "K15", "K16", "K17", "K18", "K19", "K20", "K21", "K22"],
          "note": "五步法、静安寺例子、反馈闭环和结尾未兑现开场证明均有证据。"
        }
      ]
    },
    "unsupportedInference": {
      "errors": 0,
      "total": 23,
      "examples": [
        {
          "status": "supported",
          "candidate": "KU-19",
          "note": "唯一 system_inference 以开头/结尾 cue 和结尾帧为依据，并把结论限定为未验证、无入口。"
        },
        {
          "status": "disciplined",
          "candidate": ["KU-02B", "KU-04", "KU-06B", "KU-07C"],
          "note": "可见状态、作者主张和未验证的平台因果均未升级为外部事实。"
        }
      ]
    },
    "timestampAccuracy": {
      "numerator": 22,
      "denominator": 22,
      "examples": [
        {
          "status": "correct",
          "checked": ["K01→KU-01/KU-02B", "K03→KU-03/KU-04", "K14→KU-12", "K16→KU-14", "K21→KU-17", "K22→KU-19"],
          "note": "每个审计核心单元至少检查一个 candidate 时间范围与证据锚点，均落在相应审计窗口或合理覆盖其完整语义。"
        }
      ]
    },
    "processDependencyCompleteness": {
      "applicable": true,
      "numerator": 10,
      "denominator": 10,
      "rationale": "审计 D01-D10 均由知识单元陈述、relations 或 article.md 的顺序/反馈链保存；候选把规范性流程正确限定为作者建议，而非已执行的 before/during/after 过程。"
    },
    "unknownDiscipline": {
      "numerator": 13,
      "denominator": 13,
      "examples": [
        {
          "status": "correct_unknown",
          "auditIds": ["U01", "U02", "U03", "U04", "U05", "U06"],
          "note": "增长时间线、课程范围/入口、书籍版本/官方来源、逐条归属和三感六度均被限定。"
        },
        {
          "status": "correct_unknown",
          "auditIds": ["U07", "U08", "U09", "U10"],
          "note": "平台依据、广告类别边界、五步法适用阶段/赛道/资源/例外以及静安寺无成片对照均被 article.md 明确保留。"
        },
        {
          "status": "correct_unknown",
          "auditIds": ["U11", "U12", "U13"],
          "note": "评论/CTR 定义与后台值、效果因果、非言语音频角色均未被擅自补全。"
        }
      ]
    },
    "uncheckedChannels": []
  },
  "judges": {
    "readability": 4.5,
    "knowledgePrioritization": 4.25,
    "evidenceUsefulness": 4.25,
    "executionValue": 4.25,
    "compressionWithoutLoss": 4.0
  },
  "metaAudit": {
    "pass": true,
    "unguardedCarriers": [],
    "unguardedMeaningChanges": [],
    "unguardedRelationships": [],
    "rationale": "独立审计的 12 类可用载体均能映射到候选的 9 个聚合 carrier；10 个意义变化和 21 个关系均在知识单元、relations、coverage 或 article 中被显式或语义保存。候选关系矩阵压缩较重，但未发现整类载体、意义变化或关系完全未被协议检查。"
  },
  "examples": [
    {
      "type": "strength",
      "note": "候选正确处理 CUE-037、CUE-045、CUE-057 等转写/可见字幕冲突，没有静默修正 verbatim transcript。"
    },
    {
      "type": "strength",
      "note": "开场 5 万粉快照与‘不到一周/从零’过程被清楚拆开，结尾也没有被误写成挑战结果验证。"
    },
    {
      "type": "non_blocking_discrepancy",
      "note": "reconstruction.json 的 16 个 core 声明压缩了审计的 22 个 core 单元；虽然语义覆盖仍达 21/22，但降低逐单元审计可读性。"
    },
    {
      "type": "non_blocking_discrepancy",
      "note": "coverageMatrix.cueAccountability 大量使用模板化 rationale，且 reconstruction.json 的 unknown 列表未单列五步法适用条件，后者只在 article.md 中明确出现。"
    }
  ]
}
