{
  "schemaVersion": "reconstruction-evaluation-1.0",
  "independent": true,
  "gates": {
    "criticalQuestionRecall": {
      "numerator": 12,
      "denominator": 13,
      "examples": [
        {
          "status": "covered",
          "questionIds": [
            "CQ-01",
            "CQ-02",
            "CQ-03",
            "CQ-04",
            "CQ-05",
            "CQ-06",
            "CQ-07",
            "CQ-08",
            "CQ-09",
            "CQ-10",
            "CQ-11",
            "CQ-12"
          ],
          "note": "候选正确区分了 Markdown 残留与作者所称‘乱码’，保留 dipsick/dipstick 与 DeepSeek 的载体冲突，恢复提示词与代码/预览/选择/菜单/结果状态，并把应用身份、剪辑连续性、执行桥接、参数兑现、适用边界和技术 shot 语义限制分别处理。"
        },
        {
          "status": "missed",
          "questionId": "CQ-13",
          "note": "候选只确认 AAC 音轨存在，未实际检查非语音音频内容；独立 audit 识别到低音量配乐/氛围，且未发现能独立证明发送、复制或粘贴的声音证据。"
        }
      ]
    },
    "evidenceCoverage": {
      "numerator": 12,
      "denominator": 12,
      "examples": [
        {
          "status": "covered",
          "auditUnitIds": [
            "KU-02",
            "KU-04",
            "KU-06",
            "KU-08",
            "KU-09"
          ],
          "candidateUnitIds": [
            "KU-04",
            "KU-07",
            "KU-09",
            "KU-11",
            "KU-13"
          ],
          "note": "故障字面签名、精确提示词、HTML/CSS 中间态、编辑后的转移顺序和最终排版状态均有可解析帧或 OCR 证据。"
        },
        {
          "status": "covered_with_unknown",
          "auditUnitIds": [
            "KU-11",
            "KU-12"
          ],
          "candidateUnitIds": [
            "KU-12",
            "KU-14",
            "KU-15"
          ],
          "note": "候选没有把剪辑演示升级为连续因果证明，并保留复制、运行、保存/打开、粘贴选项、版本与兼容性未知。"
        }
      ]
    },
    "unsupportedInference": {
      "errors": 0,
      "total": 29,
      "examples": [
        {
          "status": "supported",
          "claim": "可见目标界面具有 WPS AI 入口",
          "evidence": [
            "TARGET-0036",
            "TARGET-0055",
            "probe-inspection/wps-ui-crop.jpg"
          ],
          "note": "这比独立 audit 的保守身份结论更具体，但高分辨率 targeted evidence 足以支持，不计为错误。"
        },
        {
          "status": "properly_limited",
          "claim": "运行点击、复制命令、文件保存/打开、具体粘贴选项和完整因果链未被视频直接建立",
          "evidence": [
            "TARGET-0033",
            "TARGET-0039",
            "TARGET-0042",
            "TARGET-0045",
            "TARGET-0055"
          ]
        }
      ]
    },
    "timestampAccuracy": {
      "numerator": 30,
      "denominator": 30,
      "examples": [
        {
          "status": "correct",
          "refs": [
            "TARGET-0003@4.0",
            "TARGET-0023@17.0",
            "TARGET-0033@20.9",
            "TARGET-0036@21.8",
            "TARGET-0042@23.9",
            "TARGET-0045@24.8",
            "TARGET-0055@27.0"
          ],
          "note": "抽查的故障、提示词、代码、空白文档、选择、菜单和结果引用均正确落在对应状态。"
        },
        {
          "status": "correct",
          "refs": [
            "CUE-001@0.000-3.282",
            "CUE-004@13.170-18.560",
            "CUE-006@22.250-25.650",
            "CUE-007@25.660-29.071"
          ],
          "note": "字幕时间按 evidence pack 原样保留；CUE-007 的 29.071 秒尾点来自源 SRT，虽比媒体时长多 0.004 秒，不构成语义定位错误。"
        }
      ]
    },
    "processDependencyCompleteness": {
      "applicable": true,
      "numerator": 7,
      "denominator": 7,
      "rationale": "审计的七个依赖闭包为：源回答→提示词、提示词→代码状态、代码→渲染/预览、预览→文本选择、选择→复制、复制/切换→粘贴菜单、粘贴/隐藏处理→最终结果。候选对可见依赖给出证据，并将未显示的点击、复制、切换、粘贴选项和隐藏处理明确留作 unknown。"
    },
    "unknownDiscipline": {
      "numerator": 14,
      "denominator": 15,
      "examples": [
        {
          "status": "correct",
          "items": [
            "参数是否逐项兑现",
            "前后内容是否完整一致",
            "运行/复制/粘贴具体方式",
            "文本文档的文件类型",
            "模型、账号、访问、价格、地区和平台条件",
            "跨版本兼容性",
            "隐藏剪辑",
            "人物真实身份与授权"
          ],
          "note": "这些边界均未被常识补齐。"
        },
        {
          "status": "under_specified",
          "item": "privacy_notice_or_data_handling_boundary",
          "note": "独立 audit 明确核对并记录视频未提供隐私提示；候选仅写‘风险提示’，没有把隐私/数据处理边界单列。"
        }
      ]
    },
    "coverageMatrixIntegrity": {
      "numerator": 0,
      "denominator": 10,
      "examples": [
        {
          "status": "invalid_direct_evidence_refs",
          "relationshipIds": [
            "REL-01",
            "REL-02",
            "REL-03",
            "REL-04",
            "REL-05",
            "REL-06",
            "REL-07",
            "REL-08",
            "REL-09",
            "REL-10"
          ],
          "note": "coverageMatrix.relationships 的每一行都把 KU-* 单元 ID 混入 evidenceRefs。canonical deterministic validator 只接受可直接解析的 cue、shot、frame 或 source ref，因此 10/10 行均触发 relationship_evidence 错误。各行同时包含有效直接证据，问题是 coverage matrix 契约不合规，而不是关系内容本身没有证据。"
        }
      ]
    },
    "uncheckedChannels": [
      "non_speech_audio"
    ]
  },
  "judges": {
    "readability": 5,
    "knowledgePrioritization": 5,
    "evidenceUsefulness": 5,
    "executionValue": 4,
    "compressionWithoutLoss": 4
  },
  "metaAudit": {
    "pass": false,
    "unguardedCarriers": [
      "non_speech_audio: candidate confirms only track existence and declares its content/role unknown without an executed listening or audio-analysis pass"
    ],
    "unguardedMeaningChanges": [],
    "unguardedRelationships": [],
    "rationale": "候选的内部 meta-gate 不能用‘工具无法可靠判定’证明音频载体已经检查。独立 audit 实际识别到低音量配乐/氛围，并判断它不提供关键步骤证据；因此该载体仍是未闭合的可用通道。其余载体、九个意义变化和核心关系均已被协议检查或显式保留为未知。"
  },
  "examples": [
    {
      "id": "EX-01",
      "kind": "hard_gate_failure",
      "closure": "non_speech_audio",
      "candidateEvidence": [
        "probe.json CAR-09",
        "capture-protocol.json stoppingRules[7]",
        "reconstruction.json KU-19",
        "reconstruction.json metaGate"
      ],
      "auditEvidence": [
        "audit.json CAR-10",
        "audit.json CQ-13"
      ],
      "finding": "音轨存在性不是音频内容检查；把可检查载体直接标为 unknown 使 unchecked-channels 和独立 meta-gate 失败。"
    },
    {
      "id": "EX-02",
      "kind": "strong_reconstruction",
      "closure": "identity_failure_signature_and_edit_chronology",
      "finding": "候选准确恢复 DeepSeek/WPS 身份边界、Markdown 残留、提示词、代码/预览/选择/菜单/结果序列，并避免把剪辑后的状态写成完整实时教程。"
    },
    {
      "id": "EX-03",
      "kind": "minor_discrepancy",
      "closure": "decision_boundaries",
      "finding": "候选覆盖多数访问与适用边界，但未把独立 audit 中的隐私提示缺席单列。"
    },
    {
      "id": "EX-04",
      "kind": "hard_gate_failure",
      "closure": "coverage_matrix_contract",
      "finding": "canonical deterministic validation 返回 coverage_matrix FAIL：REL-01 至 REL-10 的 evidenceRefs 混入 KU-* 单元 ID，形成 21 个 relationship_evidence 错误。"
    }
  ]
}
