{
  "schemaVersion": "reconstruction-evaluation-1.0",
  "independent": true,
  "gates": {
    "criticalQuestionRecall": {
      "numerator": 8,
      "denominator": 15,
      "examples": [
        {"id": "CQ-01", "result": "pass", "note": "核心承诺、3 小时/不手写代码的作者主张及模板复用均有覆盖。"},
        {"id": "CQ-02", "result": "fail", "note": "写到 Claude Code 与 Kimi K2 Thinking，但漏掉 Moonshot 供应商、Claude Code v2.0.31 与 kimi-k2-thinking-turbo 的精确链路。"},
        {"id": "CQ-03", "result": "fail", "note": "没有给出 npm install -g @anthropic-ai/claude-code。"},
        {"id": "CQ-04", "result": "fail", "note": "提到 Kimi CLI 替代项，但没有给出 uv tool install --python 3.13 kimi-cli。"},
        {"id": "CQ-05", "result": "fail", "note": "没有给出 Moonshot Anthropic 端点及各模型环境变量。"},
        {"id": "CQ-06", "result": "pass", "note": "概括了配置后测试并确认 Claude Code 可调用模型。"},
        {"id": "CQ-07", "result": "pass", "note": "覆盖世界观、角色、剧情/玩法、数值、技术、页面与交互等结构化规格。"},
        {"id": "CQ-08", "result": "fail", "note": "未说明实现前目录已存在完整 story、5 个角色 JSON、assets/images 等；反而把框架、文本与 UI 统归为 AI 随后建立。"},
        {"id": "CQ-09", "result": "pass", "note": "覆盖外部准备图片、人工放入目录、再由 Claude Code 查找接入。"},
        {"id": "CQ-10", "result": "pass", "note": "正确限定为可运行快速原型而非可正式商业发行产品，但漏掉本地 index.html SPA 的精确形态。"},
        {"id": "CQ-11", "result": "fail", "note": "只说自然语言调整布局，没有保留‘删除中央大角色图、仅留对话框缩略图’的具体前后变化。"},
        {"id": "CQ-12", "result": "pass", "note": "把对话质量写成作者评价而非客观验证。"},
        {"id": "CQ-13", "result": "fail", "note": "虽然把 3 小时写成作者主张，但没有回答其计时是否包含策划、配置、美术与迭代，亦未明确该范围 unknown。"},
        {"id": "CQ-14", "result": "pass", "note": "明确指出发布、适配、测试、成本、安全、授权和维护未展开，并把结果限定为初版。"},
        {"id": "CQ-15", "result": "pass", "note": "覆盖联系作者索取文档/提示词的 CTA。"}
      ]
    },
    "evidenceCoverage": {
      "numerator": 0,
      "denominator": 15,
      "examples": [
        {"scope": "15 audited critical-question units", "result": "fail", "note": "baseline.md 与 baseline-process.md 均未为任何知识单元附 cue、shot、frame 或时间范围；不能把审计证据倒灌给 candidate。"},
        {"example": "安装与配置", "result": "missing_evidence", "note": "正文只写‘通过终端安装’和‘环境配置命令’，没有 CUE-007/SHOT-006 或 CUE-012/SHOT-011 等可核引用。"},
        {"example": "布局修改", "result": "missing_evidence", "note": "正文没有布局前后帧或对应时间范围。"}
      ]
    },
    "unsupportedInference": {
      "errors": 3,
      "total": 52,
      "examples": [
        {"claim": "代理式 AI 编程工具能运行项目", "result": "unsupported", "reason": "审计只证明作者双击 index.html 预览；没有证明代理执行了预览运行。"},
        {"claim": "AI 收到这些信息后，很快建立了可运行的游戏框架、文本内容和基础界面", "result": "unsupported", "reason": "剪辑前已可见完整 story、5 个角色 JSON 与现有项目结构；哪些文件在本次会话生成 unknown。"},
        {"claim": "代码、样式和项目文件仍由 AI 编程工具生成和修改", "result": "unsupported", "reason": "修改 index.html 有演示，但全体代码、样式与项目文件的生成来源未被连续记录证明。"},
        {"claim": "3 小时、不写一行代码、对话自然", "result": "supported_as_attributed_claim", "reason": "candidate 明确将这些表述归于作者，未当作独立事实。"}
      ]
    },
    "timestampAccuracy": {
      "numerator": 0,
      "denominator": 15,
      "examples": [
        {"scope": "one localization opportunity per audited critical question", "result": "fail", "note": "candidate 提供 0 个时间码和 0 个可检查证据引用；15 个单元均不可定位。"}
      ]
    },
    "processDependencyCompleteness": {
      "applicable": true,
      "numerator": 7,
      "denominator": 10,
      "rationale": "以 audit.json workflowDependencies.stages 的 0-9 共 10 个阶段逐项计数。baseline 覆盖安装、创建 API key、结构化规格、美术资产、资产接入/预览、人工审阅、自然语言改版与方法泛化中的 7 个阶段；未完整覆盖前置环境、精确 Moonshot/K2 配置状态、实现前既有项目状态。",
      "examples": [
        {"stage": 0, "result": "fail", "note": "未列 macOS/zsh、Node/npm、账户/额度等前置状态。"},
        {"stage": 1, "result": "pass", "note": "安装 Claude Code 与 Kimi CLI 替代路径均有概括。"},
        {"stage": 2, "result": "pass", "note": "获取 API Key 有覆盖。"},
        {"stage": 3, "result": "fail", "note": "缺端点、变量、模型 turbo 名称、版本及可见成功状态。"},
        {"stage": 4, "result": "fail", "note": "覆盖规格输入，却遗漏已有 story/characters/assets 的真实前状态，并错误强化为随后整体生成。"},
        {"stage": 5, "result": "pass", "note": "外部生成/准备、人工整理美术有覆盖。"},
        {"stage": 6, "result": "pass", "note": "让代理查找接入素材并打开本地预览有覆盖。"},
        {"stage": 7, "result": "pass", "note": "人工审阅对话与发现布局问题有覆盖。"},
        {"stage": 8, "result": "pass", "note": "自然语言反馈后修改并再预览有覆盖。"},
        {"stage": 9, "result": "pass", "note": "题材泛化与索取文档 CTA 有覆盖。"}
      ]
    },
    "unknownDiscipline": {
      "numerator": 18,
      "denominator": 20,
      "examples": [
        {"ids": ["U-01", "U-02", "U-03", "U-05", "U-06", "U-07", "U-08", "U-09", "U-10", "U-11", "U-12", "U-13", "U-14", "U-15", "U-16", "U-18", "U-19", "U-20"], "result": "pass", "note": "candidate 对主张作归因、明确发布/测试/成本/安全/授权边界，或没有对视频未建立的细节作正面断言。"},
        {"id": "U-04", "result": "fail", "note": "把框架、文本内容和基础界面写成 AI 接收需求后建立，未保留既有 story/characters/assets 的来源 unknown。"},
        {"id": "U-17", "result": "fail", "note": "把剪辑后的输入、生成、接入与预览串成连续因果，没有保留是否同一会话/版本的 unknown。"}
      ]
    },
    "uncheckedChannels": [
      "作者口播的原声音频通道：process 只声明通读平台 SRT，没有声明独立听检口播",
      "逐句烧录中文字幕：未作为独立于平台 SRT 的载体核对",
      "真人 A-roll、手势与镜头推进：未检查其‘简单/快速/人人可做’的修辞作用",
      "K2 Thinking 宣传/基准页：未区分营销性页面与独立性能证据",
      "Moonshot API Key 页的一次性显示/安全提示：未作为安全与复现载体单独检查"
    ]
  },
  "judges": {
    "readability": 5,
    "knowledgePrioritization": 4,
    "evidenceUsefulness": 1,
    "executionValue": 3,
    "compressionWithoutLoss": 3
  },
  "metaAudit": {
    "pass": false,
    "unguardedCarriers": [
      "精确安装/配置代码块没有被抽取为可复现参数",
      "终端与项目目录没有被用于核对实现前状态和版本连续性",
      "作者原声音频、烧录字幕、A-roll 修辞没有独立通道检查",
      "K2 产品宣传页与 API Key 安全提示没有被按证据性质区分"
    ],
    "unguardedMeaningChanges": [
      "‘AI 从零生成’到‘已有完整 story、角色 JSON、目录与图片’的起点修正被漏掉",
      "‘3 小时’到‘计时范围未定义’只做了主张归因，未回答具体范围 unknown",
      "‘自然语言很简单’到‘实际依赖高信息密度技术/系统规格’虽有概括，但精确参数与依赖被压掉",
      "‘原型可运行’到‘本地 index.html SPA、并非移动端/发布产品’只保留了粗粒度边界"
    ],
    "unguardedRelationships": [
      "Claude Code → Moonshot Anthropic 兼容端点 → kimi-k2-thinking-turbo 的供应链关系不完整",
      "既有项目内容与本次代理生成内容的 provenance 关系未建立",
      "剪辑片段是否属于同一会话/同一版本的关系被写成连续流程",
      "作者双击本地 index.html 与代理‘运行项目’的责任边界混淆"
    ],
    "rationale": "baseline 是流畅且实用的普通总结，但没有构造证据闭包：缺少引用/时间定位、漏掉起始项目状态与精确配置，并有三处把剪辑结果写成已证实的代理因果。至少一个可用载体、意义变化和知识关系仍无人守，因此 meta-gate 失败。"
  },
  "examples": [
    {"type": "strength", "text": "把‘3 小时/零手写代码/对话质量’保留为作者主张，并明确快速原型不等于正式商业发行。"},
    {"type": "strength", "text": "清楚保留结构化需求 → AI 代理 → 人工美术 → 预览反馈 → 再修改的主流程。"},
    {"type": "hard_gate_failure", "text": "0/15 核心单元具有 candidate 自带的有效证据引用，0/15 可定位到时间。"},
    {"type": "critical_omission", "text": "没有保留实现前已存在 story、5 个角色 JSON、assets/images 等项目状态。"},
    {"type": "unsupported_inference", "text": "把现有项目的框架、文本、UI 和全部代码/样式来源笼统归于本次代理生成。"}
  ]
}
